{
  "schema_version": "camelot-gideon-verdict/1",
  "verdict_id": "gv_b1936da7d34f",
  "task_id": "task_091985bfc87f",
  "correlation_id": "cor_1b042e111bc8",
  "tenant_id": "tenant_sovereign",
  "manifest_hash": "sha256:69c060f6972c4c5c1d962a635aa8f98bbb4e2d89202b4ca5ffd757ee1ebff8bb",
  "verdict": "pass",
  "gates": [
    "contract_conformance",
    "path_scope_conformance",
    "diff_integrity",
    "test_result_validity",
    "dependency_risk",
    "secret_exposure",
    "security_regression",
    "accessibility_baseline",
    "rollback_availability",
    "lifecycle_cleanup",
    "memory_provenance_for_material_claims",
    "declared_risk_tier_matches_observable_effect",
    "declared_effect_class_consistent"
  ],
  "block_reasons": [],
  "evidence_refs": [
    "receipt://evaluation/gv_b1936da7d34f"
  ],
  "issued_at": "2026-09-14T23:11:20.229821+00:00",
  "signature": "ed25519:sig_cec4fbc4ae1e439d8e71a7f4a09ab9d2"
}