{
  "schema_version": "camelot-gideon-verdict/1",
  "verdict_id": "gv_9ee2e5ca3962",
  "task_id": "task_fa268bb01ace",
  "correlation_id": "cor_d60f6b12ef7f",
  "tenant_id": "tenant_sovereign",
  "manifest_hash": "sha256:bbcf9580df034abf99f7e1626de8eed6add123d640b8f28641a244bfa2d98282",
  "verdict": "pass",
  "gates": [
    "contract_conformance",
    "path_scope_conformance",
    "diff_integrity",
    "test_result_validity",
    "dependency_risk",
    "secret_exposure",
    "security_regression",
    "accessibility_baseline",
    "rollback_availability",
    "lifecycle_cleanup",
    "memory_provenance_for_material_claims",
    "declared_risk_tier_matches_observable_effect",
    "declared_effect_class_consistent"
  ],
  "block_reasons": [],
  "evidence_refs": [
    "receipt://evaluation/gv_9ee2e5ca3962"
  ],
  "issued_at": "2026-09-23T15:54:09.730614+00:00",
  "signature": "ed25519:sig_a1ff82d5d3e748adbab35aac62686b24"
}