{
  "schema_version": "camelot-gideon-verdict/1",
  "verdict_id": "gv_d631dd03eab5",
  "task_id": "task_c27cf8643e2c",
  "correlation_id": "cor_3609fc9e87a6",
  "tenant_id": "tenant_sovereign",
  "manifest_hash": "sha256:bbcf9580df034abf99f7e1626de8eed6add123d640b8f28641a244bfa2d98282",
  "verdict": "pass",
  "gates": [
    "contract_conformance",
    "path_scope_conformance",
    "diff_integrity",
    "test_result_validity",
    "dependency_risk",
    "secret_exposure",
    "security_regression",
    "accessibility_baseline",
    "rollback_availability",
    "lifecycle_cleanup",
    "memory_provenance_for_material_claims",
    "declared_risk_tier_matches_observable_effect",
    "declared_effect_class_consistent"
  ],
  "block_reasons": [],
  "evidence_refs": [
    "receipt://evaluation/gv_d631dd03eab5"
  ],
  "issued_at": "2026-09-19T15:00:38.702470+00:00",
  "signature": "ed25519:sig_d8b9122aaafc40659dde19de1d02ca46"
}