{
  "schema_version": "camelot-gideon-verdict/1",
  "verdict_id": "gv_d56d6af97b0b",
  "task_id": "task_c29db369c0ee",
  "correlation_id": "cor_d397d5860699",
  "tenant_id": "tenant_sovereign",
  "manifest_hash": "sha256:69c060f6972c4c5c1d962a635aa8f98bbb4e2d89202b4ca5ffd757ee1ebff8bb",
  "verdict": "pass",
  "gates": [
    "contract_conformance",
    "path_scope_conformance",
    "diff_integrity",
    "test_result_validity",
    "dependency_risk",
    "secret_exposure",
    "security_regression",
    "accessibility_baseline",
    "rollback_availability",
    "lifecycle_cleanup",
    "memory_provenance_for_material_claims",
    "declared_risk_tier_matches_observable_effect",
    "declared_effect_class_consistent"
  ],
  "block_reasons": [],
  "evidence_refs": [
    "receipt://evaluation/gv_d56d6af97b0b"
  ],
  "issued_at": "2026-09-25T00:38:01.734666+00:00",
  "signature": "ed25519:sig_93e137efe0f7443da9c4967746110271"
}