{
  "schema_version": "camelot-gideon-verdict/1",
  "verdict_id": "gv_13131b52456a",
  "task_id": "task_0d04910a8bc3",
  "correlation_id": "cor_e4856376bb36",
  "tenant_id": "tenant_sovereign",
  "manifest_hash": "sha256:d6833d36d62d73562aa03ae0c0828805f3931a7382b28232c59d1a767f970fa6",
  "verdict": "block",
  "gates": [
    "contract_conformance",
    "path_scope_conformance",
    "diff_integrity",
    "test_result_validity",
    "dependency_risk",
    "secret_exposure",
    "security_regression",
    "accessibility_baseline",
    "rollback_availability",
    "lifecycle_cleanup",
    "memory_provenance_for_material_claims",
    "declared_risk_tier_matches_observable_effect",
    "declared_effect_class_consistent"
  ],
  "block_reasons": [
    "security_below_threshold (< 0.90)",
    "path_scope_violation (out of ephemeral sandbox)",
    "weighted_score_insufficient (0.775 < 0.85)"
  ],
  "evidence_refs": [
    "receipt://evaluation/gv_13131b52456a"
  ],
  "issued_at": "2026-09-25T00:38:01.754645+00:00",
  "signature": "ed25519:sig_576b301cad854c8191b57189fa4671bd"
}