{
  "schema_version": "camelot-gideon-verdict/1",
  "verdict_id": "gv_58da12d400ef",
  "task_id": "task_2bf4340e54eb",
  "correlation_id": "cor_8fa189c1c322",
  "tenant_id": "tenant_sovereign",
  "manifest_hash": "sha256:d6833d36d62d73562aa03ae0c0828805f3931a7382b28232c59d1a767f970fa6",
  "verdict": "block",
  "gates": [
    "contract_conformance",
    "path_scope_conformance",
    "diff_integrity",
    "test_result_validity",
    "dependency_risk",
    "secret_exposure",
    "security_regression",
    "accessibility_baseline",
    "rollback_availability",
    "lifecycle_cleanup",
    "memory_provenance_for_material_claims",
    "declared_risk_tier_matches_observable_effect",
    "declared_effect_class_consistent"
  ],
  "block_reasons": [
    "security_below_threshold (< 0.90)",
    "path_scope_violation (out of ephemeral sandbox)",
    "weighted_score_insufficient (0.775 < 0.85)"
  ],
  "evidence_refs": [
    "receipt://evaluation/gv_58da12d400ef"
  ],
  "issued_at": "2026-09-13T14:05:46.547977+00:00",
  "signature": "ed25519:sig_c753632829d54f0dba4cec00e60365f7"
}