{
  "schema_version": "camelot-gideon-verdict/1",
  "verdict_id": "gv_c558fed1628c",
  "task_id": "task_d4c5f99108d6",
  "correlation_id": "cor_8bd436aa810d",
  "tenant_id": "tenant_sovereign",
  "manifest_hash": "sha256:69c060f6972c4c5c1d962a635aa8f98bbb4e2d89202b4ca5ffd757ee1ebff8bb",
  "verdict": "pass",
  "gates": [
    "contract_conformance",
    "path_scope_conformance",
    "diff_integrity",
    "test_result_validity",
    "dependency_risk",
    "secret_exposure",
    "security_regression",
    "accessibility_baseline",
    "rollback_availability",
    "lifecycle_cleanup",
    "memory_provenance_for_material_claims",
    "declared_risk_tier_matches_observable_effect",
    "declared_effect_class_consistent"
  ],
  "block_reasons": [],
  "evidence_refs": [
    "receipt://evaluation/gv_c558fed1628c"
  ],
  "issued_at": "2026-09-14T23:13:16.580672+00:00",
  "signature": "ed25519:sig_43e9d728c5344eb28db60f0ae786d727"
}