{
  "schema_version": "camelot-gideon-verdict/1",
  "verdict_id": "gv_29f08f629beb",
  "task_id": "task_76d220d5b0c8",
  "correlation_id": "cor_035cff3e7787",
  "tenant_id": "tenant_sovereign",
  "manifest_hash": "sha256:bbcf9580df034abf99f7e1626de8eed6add123d640b8f28641a244bfa2d98282",
  "verdict": "pass",
  "gates": [
    "contract_conformance",
    "path_scope_conformance",
    "diff_integrity",
    "test_result_validity",
    "dependency_risk",
    "secret_exposure",
    "security_regression",
    "accessibility_baseline",
    "rollback_availability",
    "lifecycle_cleanup",
    "memory_provenance_for_material_claims",
    "declared_risk_tier_matches_observable_effect",
    "declared_effect_class_consistent"
  ],
  "block_reasons": [],
  "evidence_refs": [
    "receipt://evaluation/gv_29f08f629beb"
  ],
  "issued_at": "2026-09-14T22:58:25.433030+00:00",
  "signature": "ed25519:sig_a42a671ee6d04d1493355cd74f2db877"
}