{
  "schema_version": "camelot-gideon-verdict/1",
  "verdict_id": "gv_91e2a681b3f0",
  "task_id": "task_4c8ccbc3f8b0",
  "correlation_id": "cor_2ce1f9936e2e",
  "tenant_id": "tenant_sovereign",
  "manifest_hash": "sha256:69c060f6972c4c5c1d962a635aa8f98bbb4e2d89202b4ca5ffd757ee1ebff8bb",
  "verdict": "pass",
  "gates": [
    "contract_conformance",
    "path_scope_conformance",
    "diff_integrity",
    "test_result_validity",
    "dependency_risk",
    "secret_exposure",
    "security_regression",
    "accessibility_baseline",
    "rollback_availability",
    "lifecycle_cleanup",
    "memory_provenance_for_material_claims",
    "declared_risk_tier_matches_observable_effect",
    "declared_effect_class_consistent"
  ],
  "block_reasons": [],
  "evidence_refs": [
    "receipt://evaluation/gv_91e2a681b3f0"
  ],
  "issued_at": "2026-09-13T14:38:26.012739+00:00",
  "signature": "ed25519:sig_a41cb921bbfa448bae1771ed34d4f29f"
}