{
  "schema_version": "camelot-gideon-verdict/1",
  "verdict_id": "gv_dab9a265ef34",
  "task_id": "task_505edca2697e",
  "correlation_id": "cor_df66389b410a",
  "tenant_id": "tenant_sovereign",
  "manifest_hash": "sha256:8fd0bfd747c01d9385ca103c8f0bf35c2925e00da5a6594d0837affc1a33d9f3",
  "verdict": "pass",
  "gates": [
    "contract_conformance",
    "path_scope_conformance",
    "diff_integrity",
    "test_result_validity",
    "dependency_risk",
    "secret_exposure",
    "security_regression",
    "accessibility_baseline",
    "rollback_availability",
    "lifecycle_cleanup",
    "memory_provenance_for_material_claims",
    "declared_risk_tier_matches_observable_effect",
    "declared_effect_class_consistent"
  ],
  "block_reasons": [],
  "evidence_refs": [
    "receipt://evaluation/gv_dab9a265ef34"
  ],
  "issued_at": "2026-09-14T23:23:24.349553+00:00",
  "signature": "ed25519:sig_672964f2411842879a3884eecec28296"
}